<?xml version="1.0" encoding="UTF-8"?>
<!ELEMENT html (header,body)>
<!ELEMENT header (title)>
<!ELEMENT title (#PCDATA)>
<!ELEMENT body (div|p|span)*>
<!ELEMENT div (#PCDATA)>
<!ELEMENT p (#PCDATA)>
<!ELEMENT span (#PCDATA)>
